,id,text,question_id,is_correct,has_image_alt,alternative,answer_image
8293,8294,correlação entre força de trabalho e migração sazonal.,1659,0,0,d,
8294,8295,indissociabilidade entre local de moradia e acesso à renda.,1659,0,0,e,
8295,8296,A vivência dos fenômenos do mundo.,1660,0,0,a,
8296,8297,A potência inata da mente.,1660,0,0,b,
8297,8298,O desenvolvimento do raciocínio abstrato.,1660,0,0,c,
8298,8299,A revelação da inspiração divina.,1660,1,0,d,
8299,8300,O estudo das tradições filosóficas.,1660,0,0,e,
8300,8301,extinção na vegetação nativa.,1661,0,0,a,
8301,8302,recepção de densa carga de dejetos.,1661,0,0,b,
8302,8303,valorização do sítio urbano.,1661,1,0,c,
8303,8304,captação desordenada do regime pluvial.,1661,0,0,d,
8304,8305,expansão do uso de defensivos químicos.,1661,0,0,e,
8305,8306,conferir prerrogativas políticas aos descendentes de estrangeiros.,1662,0,0,a,
8306,8307,assegurar garantias individuais aos cidadãos livres.,1662,1,0,b,
8307,8308,tipificar regras referentes aos atos dignos de punição.,1662,0,0,c,
8308,8309,conceder benefícios de indulto aos prisioneiros de guera.,1662,0,0,d,
8309,8310,promover distribuição de terras aos desempregados urbanos.,1662,0,0,e,
8310,8311,"Democracia e sociedade, pois se referem a relações sociais.",1663,1,0,a,
8311,8312,"Ética e política, pois conduzem à eudaimonia.",1663,0,0,b,
8312,8313,"Geração e corrupção, pois abarcam o campo da physis.",1663,0,0,c,
8313,8314,"Retórica e linguagem, pois cuidam dos discursos na ágora.",1663,0,0,d,
8314,8315,"Metafísica e ontologia, pois tratam da filosofia primeira.",1663,0,0,e,
8315,8316,incremento da fabricação em massa.,1664,0,0,a,
8316,8317,adequação da produção à demanda.,1664,0,0,b,
8317,8318,expansão dos grandes estoques.,1664,1,0,c,
8318,8319,aumento da mecanização do trabalho.,1664,0,0,d,
8319,8320,centralização das etapas de planejamento.,1664,0,0,e,
8320,8321,coibir o funcionamento de empresas agroindustriais no campo.,1665,0,0,a,
8321,8322,reverter o processo de privatização fundiária.,1665,0,0,b,
8322,8323,ressaltar a inviabilidade da produção latifundiária.,1665,1,0,c,
8323,8324,defender a desapropriação dos espaços improdutivos.,1665,0,0,d,
8324,8325,impedir a produção exportadora nas terras agriculturáveis.,1665,0,0,e,
8325,8326,Reformulação do acesso ao ensino superior e do financiamento científico nacional.,1666,0,0,a,
8326,8327,Expansão dos investimentos nas empresas públicas e nos bancos estatais.,1666,0,0,b,
8327,8328,Reforma das políticas macroeconômicas e dos mecanismos de controle inflacionário.,1666,0,0,c,
8328,8329,Democratização do crédito habitacional e da aquisição de moradias populares.,1666,0,0,d,
8329,8330,Enxugamento da carga fiscal individual e da contribuição tributária empresarial.,1666,1,0,e,
8330,8331,Origem étnica dos grupos de trabalhadores.,1667,0,0,a,
8331,8332,Conhecimento das tarefas desenvolvidas.,1667,0,0,b,
8332,8333,Oferta de contrato formal.,1667,0,0,c,
8333,8334,Controle opressivo das vidas dos indivíduos.,1667,1,0,d,
8334,8335,Investimento requerido dos empregadores.,1667,0,0,e,
8335,8336,monitoramento do fluxo alfandegário.,1668,0,0,a,
8336,8337,expansão do setor extrativista.,1668,0,0,b,
8337,8338,incremento da atividade agrícola.,1668,0,0,c,
8338,8339,diversificação da matriz energética.,1668,1,0,d,
8339,8340,fortalecimento da pesquisa científica.,1668,0,0,e,
8340,8341,exatidão da demarcação das regiões.,1669,0,0,a,
8341,8342,asserção da cultura dos nativos.,1669,0,0,b,
8342,8343,aprimoramento do conceito de fronteira.,1669,1,0,c,
8343,8344,avanço dos estudos do ambiente.,1669,0,0,d,
8344,8345,afirmação das formas de dominação.,1669,0,0,e,
8345,8346,manutenção do status quo gerencial e dos padrões de socialização familiar.,1670,0,0,a,
8346,8347,desestruturação da herança patriarcal e das mudanças do perfil ocupacional.,1670,1,0,b,
8347,8348,estagnação de direitos adquiridos e do anacronismo da legislação vigente.,1670,0,0,c,
8348,8349,disputas na composição sindical e da presença na esfera político-partidária.,1670,0,0,d,
8349,8350,exigências de aperfeiçoamento profissional e de habilidades na competência diretiva.,1670,0,0,e,
8350,8351,interpretação das manifestações do divino.,1671,0,0,a,
8351,8352,adesão ao método positivista.,1671,0,0,b,
8352,8353,expressão do papel das elites.,1671,0,0,c,
8353,8354,resgate das narrativas heroicas.,1671,1,0,d,
8354,8355,acesso ao cotidiano das comunidades.,1671,0,0,e,
8355,8356,incentivo governamental e conservação de territórios.,1672,0,0,a,
8356,8357,crescimento econômico e migração de trabalhadores.,1672,0,0,b,
8357,8358,modernização de plantio e comércio de látex.,1672,1,0,c,
8358,8359,produção de borracha e escassez de recursos naturais.,1672,0,0,d,
8359,8360,reivindicação de terra e preservação de mata nativa.,1672,0,0,e,
8360,8361,rifteamento da crosta terrestre.,1673,0,0,a,
8361,8362,subducção da plataforma oceânica.,1673,1,0,b,
8362,8363,colisão de placas tectônicas.,1673,0,0,c,
8363,8364,formação de cadeias montanhosas.,1673,0,0,d,
8364,8365,metamorfismo de bordas continentais.,1673,0,0,e,
8365,8366,entendimento do contratualismo moderno.,1674,0,0,a,
8366,8367,ideal republicano de governo.,1674,0,0,b,
8367,8368,corrente tripartite dos poderes.,1674,0,0,c,
8368,8369,posicionamento crítico do socialismo.,1674,0,0,d,
8369,8370,legitimidade do absolutismo monárquico.,1674,1,0,e,
8370,8371,adesão ao ascetismo contemplativo.,1675,0,0,a,
8371,8372,propagação do ideário cristão.,1675,0,0,b,
8372,8373,alfabetização dos indígenas nas Missões.,1675,1,0,c,
8373,8374,valorização do trabalho braçal.,1675,0,0,d,
8374,8375,adoção do cativeiro na Colônia.,1675,0,0,e,
8375,8376,Propagação de organizações em redes.,1676,0,0,a,
8376,8377,Eliminação das diferenças regionais.,1676,1,0,b,
8377,8378,Erradicação dos conflitos em territórios.,1676,0,0,c,
8378,8379,Ampliação de modelo democrático,1676,0,0,d,
8379,8380,Projeção da diplomacia mundial.,1676,0,0,e,
8380,8381,"violência senhorial, que impunha a desestruturação forçada das famílias escravas.",1677,0,0,a,
8381,8382,"regra judaica, que pregava a superioridade espiritual dos cultos das sinagogas.",1677,0,0,b,
8382,8383,"moralismo da legislação, que dificultava as reuniões abertas da juventude livre.",1677,0,0,c,
8383,8384,"adesão do patriarcado, que subvertia o conceito original dos valores estrangeiros.",1677,1,0,d,
8384,8385,"decisão política, que censurava as manifestações públicas da doutrina dissidente.",1677,0,0,e,
8385,8386,eficiência das técnicas de irrigação.,1678,0,0,a,
8386,8387,fertilização química do solo.,1678,0,0,b,
8387,8388,velocidade das máquinas colheitadeiras.,1678,0,0,c,
8388,8389,escoamento hídrico do terreno.,1678,1,0,d,
8389,8390,manutenção de poços artesianos.,1678,0,0,e,
8390,8391,imposição da escravidão por dívidas.,1679,0,0,a,
8391,8392,restrição da cidadania por parentesco.,1679,0,0,b,
8392,8393,demarcação de terras públicas,1679,0,0,c,
8393,8394,restauração de instituições ancestrais.,1679,0,0,d,
8394,8395,expansão das fronteiras extrapeninsulares.,1679,1,0,e,
8395,8396,"existencialista, na questão do reconhecimento de si.",1680,0,0,a,
8396,8397,"marxista, no contexto do materialismo histórico.",1680,0,0,b,
8397,8398,"logicista, no propósito de entendimento dos fatos",1680,0,0,c,
8398,8399,"utilitarista, no sentido da racionalidade das ações.",1680,0,0,d,
8399,8400,"pós-modernista, na discussão da fluidez das relações.",1680,1,0,e,
8400,8401,drenagem eficiente.,1681,1,0,a,
8401,8402,solo fértil.,1681,0,0,b,
8402,8403,clima ameno.,1681,0,0,c,
8403,8404,encosta íngreme.,1681,0,0,d,
8404,8405,vegetação diversificada.,1681,0,0,e,
8405,8406,Planaltos cristalinos.,1682,0,0,a,
8406,8407,Depressões absolutas.,1682,0,0,b,
8407,8408,Planícies abissais.,1682,0,0,c,
8408,8409,Bacias sedimentares.,1682,0,0,d,
8409,8410,Dobramentos modernos.,1682,1,0,e,
8410,8411,reservas de combustível fóssil.,1683,0,0,a,
8411,8412,fontes de águas termais.,1683,0,0,b,
8412,8413,afloramentos de sal-gema.,1683,1,0,c,
8413,8414,jazidas de minerais metálicos.,1683,0,0,d,
8414,8415,depósitos de calcário agrícola.,1683,0,0,e,
8415,8416,soberania do poder governamental.,1684,0,0,a,
8416,8417,primazia da gestão popular,1684,0,0,b,
8417,8418,ampliação da participação empresarial,1684,0,0,c,
8418,8419,uso de práticas sustentáveis,1684,0,0,d,
8419,8420,construção do bem-estar social.,1684,1,0,e,
8420,8421,Cozimento.,1685,0,0,a,
8421,8422,Prensagem.,1685,0,0,b,
8422,8423,Trituração.,1685,0,0,c,
8423,8424,Extração.,1685,1,0,d,
8424,8425,Destilação.,1685,0,0,e,
8425,8426,Difração.,1686,0,0,a,
8426,8427,Absorção.,1686,1,0,b,
8427,8428,Interferência.,1686,0,0,c,
8428,8429,Polarização.,1686,0,0,d,
8429,8430,Reflexão.,1686,0,0,e,
8430,8431,deformação da borracha de vedação.,1687,0,0,a,
8431,8432,aumento da pressão interna e os riscos de explosão.,1687,0,0,b,
8432,8433,consumo de gás desnecessário.,1687,0,0,c,
8433,8434,dilatação da panela e a desconexão com sua tampa.,1687,0,0,d,
8434,8435,perda da qualidade nutritiva do alimento.,1687,1,0,e,
8435,8436,Cromoterapia.,1688,0,0,a,
8436,8437,Quimioterapia.,1688,0,0,b,
8437,8438,Radioterapia.,1688,0,0,c,
8438,8439,Fotoimunoterapia.,1688,1,0,d,
8439,8440,Terapia magnética.,1688,0,0,e,
8440,8441,elevada energia de ativação.,1689,0,0,a,
8441,8442,alta pressão.,1689,0,0,b,
8442,8443,alta temperatura.,1689,0,0,c,
8443,8444,excesso de reagentes.,1689,1,0,d,
8444,8445,maior superfície de contato.,1689,0,0,e,
8445,8446,Aqueceria com secador de cabelos.,1690,0,0,a,
8446,8447,Resfriaria no congelador.,1690,0,0,b,
8447,8448,Embrulharia em guardanapo de papel.,1690,0,0,c,
8448,8449,Borrifaria com spray de água.,1690,1,0,d,
8449,8450,Envolveria com papel alumínio.,1690,0,0,e,
8450,8451,excreção de ácido úrico que confere estabilidade ao pH corporal.,1691,0,0,a,
8451,8452,exoesqueleto constituído de quitina que auxilia no controle hídrico corporal.,1691,0,0,b,
8452,8453,quelíceras e pedipalpos que coordenam o movimento corporal.,1691,1,0,c,
8453,8454,circulação sanguínea aberta que impede a desidratação dos tecidos corporais.,1691,0,0,d,
8454,8455,sistema nervoso ganglionar que promove a coordenação central do movimento corporal.,1691,0,0,e,
8455,8456,refazer a camada de cera impermeabilizante das penas.,1692,0,0,a,
8456,8457,recuperar o tônus muscular.,1692,0,0,b,
8457,8458,restaurar a massa corporal.,1692,0,0,c,
8458,8459,substituir as penas danificadas.,1692,0,0,d,
8459,8460,restabelecer a capacidade de homeotermia.,1692,1,0,e,
8460,8461,limitação de transferência de energia entre os seres vivos.,1693,1,0,a,
8461,8462,redução do potencial hidrogeniônico da água.,1693,0,0,b,
8462,8463,retração dos oceanos pelo congelamento do gás nos polos.,1693,0,0,c,
8463,8464,restrição da aerobiose pelo excesso de poluentes.,1693,0,0,d,
8464,8465,diminuição da emissão de oxigênio pelos autótrofos.,1693,0,0,e,
8465,8466,"3,6°C",1694,0,0,a,
8466,8467,"0,9°C",1694,0,0,b,
8467,8468,"4,0ºC",1694,1,0,c,
8468,8469,"0,6°C",1694,0,0,d,
8469,8470,"0,3°C",1694,0,0,e,
8470,8471,liberação de oxigênio.,1695,0,0,a,
8471,8472,aumento da incidência de luz solar.,1695,0,0,b,
8472,8473,diminuição da absorção de água.,1695,1,0,c,
8473,8474,estabilização da umidade,1695,0,0,d,
8474,8475,elevação de temperatura.,1695,0,0,e,
8475,8476,Permitir a liberação do princípio ativo pela ação das amilases salivares.,1696,0,0,a,
8476,8477,Diminuir a absorção do princípio ativo no intestino.,1696,0,0,b,
8477,8478,Facilitar a liberação do fármaco pela ação dos sais biliares sobre o revestimento.,1696,1,0,c,
8478,8479,Impedir que o fármaco seja solubilizado no intestino.,1696,0,0,d,
8479,8480,Garantir que o fármaco não seja afetado pelas secreções gástricas.,1696,0,0,e,
8480,8481,2,1697,1,0,a,
8481,8482,3,1697,0,0,b,
8482,8483,1,1697,0,0,c,
8483,8484,4,1697,0,0,d,
8484,8485,5,1697,0,0,e,
8485,8486,V,1698,0,0,a,
8486,8487,I,1698,1,0,b,
8487,8488,II,1698,0,0,c,
8488,8489,III,1698,0,0,d,
8489,8490,IV,1698,0,0,e,
8490,8491,"Entre B e E; 0,9 mA.",1699,0,0,a,
8491,8492,Entre A e C; 30 mA.,1699,0,0,b,
8492,8493,"Entre A e E; 0,9 mA.",1699,0,0,c,
8493,8494,Entre B e E; 30 mA.,1699,1,0,d,
8494,8495,"Entre A e D; 1,2 mA.",1699,0,0,e,
8495,8496,os resíduos produzidos na queima de fogos de artifício ainda são explosivos.,1700,0,0,a,
8496,8497,o sódio e o potássio são os principais responsáveis pela toxicidade do produto da queima.,1700,0,0,b,
8497,8498,as substâncias resultantes da queima de fogos de artifício são inflamáveis.,1700,0,0,c,
8498,8499,os produtos da queima contêm metais pesados e gases tóxicos que resultam em poluição atmosférica.,1700,1,0,d,
8499,8500,o material particulado gerado se deposita na superfície das folhas das plantas impedindo os processos de respiração celular.,1700,0,0,e,
8500,8501,melhoramento genético.,1701,0,0,a,
8501,8502,hibridismo.,1701,1,0,b,
8502,8503,transgenia.,1701,0,0,c,
8503,8504,conjugação.,1701,0,0,d,
8504,8505,terapia gênica.,1701,0,0,e,
8505,8506,144 Hz,1702,0,0,a,
8506,8507,137 Hz.,1702,0,0,b,
8507,8508,159 Hz,1702,1,0,c,
8508,8509,138 Hz.,1702,0,0,d,
8509,8510,141 Hz.,1702,0,0,e,
8510,8511,Efeito de para-raios da antena.,1703,0,0,a,
8511,8512,Blindagem pela carcaça metálica.,1703,0,0,b,
8512,8513,Isolamento elétrico dos pneus.,1703,1,0,c,
8513,8514,Escoamento da água pela lataria.,1703,0,0,d,
8514,8515,Aterramento pelo fio terra da bateria.,1703,0,0,e,
8515,8516,120.,1704,1,0,a,
8516,8517,50.,1704,0,0,b,
8517,8518,60.,1704,0,0,c,
8518,8519,95.,1704,0,0,d,
8519,8520,99.,1704,0,0,e,
8520,8521,Falha na separação durante a meiose gamética em ambas as plantas parentais.,1705,1,0,a,
8521,8522,Duplicação em uma das plantas parentais antes do cruzamento.,1705,0,0,b,
8522,8523,Deleções durante as primeiras mitoses zigóticas na planta descendente C. arabica,1705,0,0,c,
8523,8524,Inversão durante a meiose gamética em ambas as plantas parentais.,1705,0,0,d,
8524,8525,Separação desigual na meiose gamética de uma das plantas parentais.,1705,0,0,e,
8525,8526,Verde.,1706,0,0,a,
8526,8527,Violeta.,1706,0,0,b,
8527,8528,Anil.,1706,0,0,c,
8528,8529,Amarelo.,1706,0,0,d,
8529,8530,Vermelho.,1706,1,0,e,
8530,8531,,1707,0,1,a,https://raw.githubusercontent.com/carlosjuniorcosta1/django-app-school/master/useful_files/enem-data/enem-2020/106-images/alt_img_4.png
8531,8532,,1707,1,1,b,https://raw.githubusercontent.com/carlosjuniorcosta1/django-app-school/master/useful_files/enem-data/enem-2020/106-images/alt_img_0.png
8532,8533,,1707,0,1,c,https://raw.githubusercontent.com/carlosjuniorcosta1/django-app-school/master/useful_files/enem-data/enem-2020/106-images/alt_img_1.png
8533,8534,,1707,0,1,d,https://raw.githubusercontent.com/carlosjuniorcosta1/django-app-school/master/useful_files/enem-data/enem-2020/106-images/alt_img_2.png
8534,8535,,1707,0,1,e,https://raw.githubusercontent.com/carlosjuniorcosta1/django-app-school/master/useful_files/enem-data/enem-2020/106-images/alt_img_3.png
8535,8536,B e D.,1708,0,0,a,
8536,8537,A e B,1708,0,0,b,
8537,8538,C e D.,1708,0,0,c,
8538,8539,A e C.,1708,1,0,d,
8539,8540,B e C.,1708,0,0,e,
8540,8541,"S. mansoni, T. saginata e Ancylostoma.",1709,0,0,a,
8541,8542,"Ancylostoma, A. lumbricoides e A. suum.",1709,0,0,b,
8542,8543,"A. lumbricoides, A. suum e S. mansoni.",1709,1,0,c,
8543,8544,"T. saginata, S. mansoni e A. lumbricoides.",1709,0,0,d,
8544,8545,"A. lumbricoides, A. suum e T. saginata",1709,0,0,e,
8545,8546,decantar a mistura separando os dois componentes em um funil adequado.,1710,0,0,a,
8546,8547,evaporar o acetato de etila sem alterar o conteúdo de água.,1710,0,0,b,
8547,8548,filtrar a mistura utilizando um funil comum e um papel de filtro.,1710,0,0,c,
8548,8549,realizar uma destilação simples para separar a água do acetato de etila.,1710,0,0,d,
8549,8550,proceder a uma centrifugação da mistura para remover o acetato de etila.,1710,1,0,e,
8550,8551,4,1711,1,0,a,
8551,8552,1,1711,0,0,b,
8552,8553,5,1711,0,0,c,
8553,8554,2,1711,0,0,d,
8554,8555,3,1711,0,0,e,
8555,8556,Cl2,1712,0,0,a,
8556,8557,CO,1712,0,0,b,
8557,8558,H2,1712,0,0,c,
8558,8559,CO2,1712,0,0,d,
8559,8560,HCl,1712,1,0,e,
8560,8561,60%.,1713,0,0,a,
8561,8562,11%.,1713,0,0,b,
8562,8563,19%,1713,0,0,c,
8563,8564,26%,1713,1,0,d,
8564,8565,36%,1713,0,0,e,
8565,8566,são degradados em um tempo bastante menor que os convencionais.,1714,0,0,a,
8566,8567,não são tóxicos.,1714,0,0,b,
8567,8568,apresentam propriedades mecânicas semelhantes aos convencionais.,1714,0,0,c,
8568,8569,não precisam ser reciclados.,1714,1,0,d,
8569,8570,não causam poluição ambiental quando descartados.,1714,0,0,e,
8570,8571,Diminuição do número de prótons nos pelos do gato.,1715,0,0,a,
8571,8572,Criação de novas partículas eletrizadas nos pelos do gato.,1715,0,0,b,
8572,8573,Troca de átomos entre a calça e os pelos do gato.,1715,0,0,c,
8573,8574,Movimentação de elétrons entre a calça e os pelos do gato.,1715,1,0,d,
8574,8575,Repulsão entre partículas elétricas da calça e dos pelos do gato.,1715,0,0,e,
8575,8576,"35s, 60s e 85s.",1716,0,0,a,
8576,8577,"20s, 45s e 70s.",1716,0,0,b,
8577,8578,"25s, 50s e 75s.",1716,0,0,c,
8578,8579,"28s, 42s e 53s.",1716,1,0,d,
8579,8580,"30s, 55s e 80s.",1716,0,0,e,
8580,8581,D2 coexistem duas populações com características fenotípicas distintas.,1717,0,0,a,
8581,8582,Dl ocorre um novo fator de isolamento geográfico.,1717,0,0,b,
8582,8583,D2 foram preservadas as mesmas características fenotípicas da população original A.,1717,1,0,c,
8583,8584,Dl existe uma única população distribuída em gradiente.,1717,0,0,d,
8584,8585,Dl ocorrem duas populações separadas por isolamento reprodutivo.,1717,0,0,e,
8585,8586,"6,25 x 10–2 mol L–1",1718,0,0,a,
8586,8587,"1,25 x 10–1 mol L–1",1718,1,0,b,
8587,8588,"2,50 x 10–3 mol L–1",1718,0,0,c,
8588,8589,"2,50 x 10–1 mol L–1",1718,0,0,d,
8589,8590,"4,27 x 10–1 mol L–1",1718,0,0,e,
8590,8591,,1719,0,1,a,https://raw.githubusercontent.com/carlosjuniorcosta1/django-app-school/master/useful_files/enem-data/enem-2020/108-images/alt_img_4.png
8591,8592,,1719,0,1,b,https://raw.githubusercontent.com/carlosjuniorcosta1/django-app-school/master/useful_files/enem-data/enem-2020/108-images/alt_img_0.png
8592,8593,,1719,0,1,c,https://raw.githubusercontent.com/carlosjuniorcosta1/django-app-school/master/useful_files/enem-data/enem-2020/108-images/alt_img_1.png
8593,8594,,1719,1,1,d,https://raw.githubusercontent.com/carlosjuniorcosta1/django-app-school/master/useful_files/enem-data/enem-2020/108-images/alt_img_2.png
8594,8595,,1719,0,1,e,https://raw.githubusercontent.com/carlosjuniorcosta1/django-app-school/master/useful_files/enem-data/enem-2020/108-images/alt_img_3.png
8595,8596,a liquefação da substância refrigerante no condensador exige mais trabalho do compressor.,1720,0,0,a,
8596,8597,o fluxo de calor por condução no condensador sofre considerável redução.,1720,0,0,b,
8597,8598,as correntes de convecção nas proximidades do condensador ocorrem com maior dificuldade.,1720,0,0,c,
8598,8599,a temperatura da substância refrigerante no condensador diminui mais rapidamente.,1720,1,0,d,
8599,8600,o fluxo de calor promove significativa elevação da temperatura no interior do refrigerador.,1720,0,0,e,
8600,8601,"fluxo magnético através das bobinas, por meio de um aumento em sua área interna exposta ao campo magnético aplicado.",1721,0,0,a,
8601,8602,"intensidade do campo magnético no qual as bobinas estão imersas, por meio de aplicação de campos magnéticos mais intensos.",1721,0,0,b,
8602,8603,"intervalo de tempo em que as bobinas ficam imersas no campo magnético externo, por meio de uma diminuição de velocidade no eixo de rotação do gerador.",1721,0,0,c,
8603,8604,"rapidez com que o fluxo magnético varia através das bobinas, por meio de um aumento em sua velocidade angular.",1721,1,0,d,
8604,8605,"resistência interna do condutor que constitui as bobinas, por meio de um aumento na espessura dos terminais.",1721,0,0,e,
8605,8606,"fósforo, devido à liberação dos fosfatos acumulados no ambiente marinho.",1722,0,0,a,
8606,8607,"nitrogênio, devido à nitrificação ambiental transformando amônia em nitrito.",1722,0,0,b,
8607,8608,"nitrogênio, devido ao aumento dos compostos nitrogenados no ambiente terrestre.",1722,0,0,c,
8608,8609,"carbono, devido ao aumento dos carbonatos dissolvidos no ambiente marinho.",1722,1,0,d,
8609,8610,"carbono, devido à liberação das cadeias carbônicas aprisionadas abaixo dos sedimentos.",1722,0,0,e,
8610,8611,3A + 2B → 2C → 3D + 2E (a reação ocorre sob pressão atmosférica).,1723,0,0,a,
8611,8612,A + B + C → D (a reação ocorre a altas pressões).,1723,0,0,b,
8612,8613,A + 1/2 B → C (a reação ocorre com o uso de um catalisador contendo um metal não tóxico).,1723,0,0,c,
8613,8614,A + B → C + D (a reação é fortemente endotérmica).,1723,0,0,d,
8614,8615,A +3B → C (a reação ocorre com uso de solvente orgânico).,1723,1,0,e,
8615,8616,B.,1724,1,0,a,
8616,8617,C.,1724,0,0,b,
8617,8618,A.,1724,0,0,c,
8618,8619,D.,1724,0,0,d,
8619,8620,E.,1724,0,0,e,
8620,8621,106,1725,0,0,a,
8621,8622,100,1725,0,0,b,
8622,8623,101,1725,1,0,c,
8623,8624,102,1725,0,0,d,
8624,8625,104,1725,0,0,e,
8625,8626,"y = 1,125x",1726,1,0,a,
8626,8627,"y = 1,265x",1726,0,0,b,
8627,8628,y = x,1726,0,0,c,
8628,8629,"y = 1,250x",1726,0,0,d,
8629,8630,"y = 1,150x",1726,0,0,e,
8630,8631,80.,1727,0,0,a,
8631,8632,60.,1727,0,0,b,
8632,8633,100.,1727,1,0,c,
8633,8634,40.,1727,0,0,d,
8634,8635,20.,1727,0,0,e,
8635,8636,5.,1728,0,0,a,
8636,8637,1.,1728,1,0,b,
8637,8638,2.,1728,0,0,c,
8638,8639,3.,1728,0,0,d,
8639,8640,4.,1728,0,0,e,
8640,8641,"descrever a vida de um sujeito que nunca resolve suas inquietações e, por isso, mantém-se silencioso.",1729,1,0,a,
8641,8642,contrapor a individualidade de um sujeito a uma estrutura social marcada pela decepção na atuação política.,1729,0,0,b,
8642,8643,usar um apelido jocoso para designar a atuação de um indivíduo em seu próprio bairro.,1729,0,0,c,
8643,8644,demonstrar que o problema sofrido pelo indivíduo atinge toda a comunidade.,1729,0,0,d,
8644,8645,relativizar a importância que se dá ao sofrimento individual em uma estrutura social baseada na exploração.,1729,0,0,e,
8645,8646,desejo de pertencimento ao espaço estadunidense.,1730,0,0,a,
8646,8647,certeza de manutenção de suas tradições.,1730,0,0,b,
8647,8648,rejeição da língua utilizada por seus antepassados.,1730,0,0,c,
8648,8649,reivindicação de um mundo unificado.,1730,0,0,d,
8649,8650,sentimento de conflito de identidades.,1730,1,0,e,
8650,8651,evidenciam uma mudança de comportamento.,1731,0,0,a,
8651,8652,reforçam um padrão de beleza.,1731,0,0,b,
8652,8653,retratam um conflito de gerações.,1731,1,0,c,
8653,8654,revelam uma atitude de resistência.,1731,0,0,d,
8654,8655,demonstram uma postura de imaturidade.,1731,0,0,e,
8655,8656,sotaque reforçado dos personagens a fim de marca.r o espaço do cinema argentino.,1732,0,0,a,
8656,8657,cômico como fuga da sociedade diante de situações violentas.,1732,0,0,b,
8657,8658,autorreconhecimento diante dos diversos tipos de comportamento humano frente à violência.,1732,0,0,c,
8658,8659,estado de apatia da sociedade perante a violência rotineira do mundo atual.,1732,0,0,d,
8659,8660,empecilho para o espectador vivenciar a violência bruta na realidade e na ficção.,1732,1,0,e,
8660,8661,descrições artísticas detalhadas de uma obra conhecida.,1733,0,0,a,
8661,8662,aceitação de um diagnóstico de doença terminal do filho.,1733,0,0,b,
8662,8663,demonstração de orgulho por não precisar pedir doações.,1733,0,0,c,
8663,8664,consternação ao visitar o túmulo do filho recém-falecido.,1733,0,0,d,
8664,8665,impressões sensoriais experimentadas no ambiente.,1733,1,0,e,
8665,8666,criticam os estereótipos sociais das visões de mundo elitistas.,1734,1,0,a,
8666,8667,expressam a futilidade do discurso de poder e de distinção do narrador.,1734,0,0,b,
8667,8668,disfarçam a falta de densidade das angústias existenciais narradas.,1734,0,0,c,
8668,8669,ironizam a valorização da cultura norte-americana pelos brasileiros.,1734,0,0,d,
8669,8670,explicitam a ganância financeira do capitalismo contemporâneo.,1734,0,0,e,
8670,8671,a complexidade relacionada ao conceito de liberdade impede o compromisso.,1735,0,0,a,
8671,8672,o compromisso político afasta o artista da criação.,1735,0,0,b,
8672,8673,os intelectuais latino-americanos têm um posiciona - mento acrítico perante o poder.,1735,1,0,c,
8673,8674,os costumes sociais governam a linguagem e as atitudes das pessoas.,1735,0,0,d,
8674,8675,o compromisso ideológico de alguns intelectuais está refletido em suas obras.,1735,0,0,e,
8675,8676,justificar o gênio difícil de Chiquito.,1736,0,0,a,
8676,8677,legitimar o direito do filho à herança.,1736,1,0,b,
8677,8678,criticar a natureza forte do filho.,1736,0,0,c,
8678,8679,conter o ânimo violento de Chico Lourenço.,1736,0,0,d,
8679,8680,condenar a agressividade do marido contra o filho.,1736,0,0,e,
8680,8681,transferência de responsabilidade.,1737,0,0,a,
8681,8682,conclusão de uma ação.,1737,0,0,b,
8682,8683,realização de um evento.,1737,0,0,c,
8683,8684,repetição de uma prática.,1737,1,0,d,
8684,8685,continuidade de um processo.,1737,0,0,e,
8685,8686,"relato, pois narra um fato estressante vivido pela paciente.",1738,0,0,a,
8686,8687,"conto, pois exibe a história de vida de Joanie Simpson.",1738,0,0,b,
8687,8688,"notícia, pois divulga fatos sobre a síndrome do coração partido.",1738,0,0,c,
8688,8689,"depoimento, pois expõe o sofrimento da dona do animal.",1738,0,0,d,
