,id,text,question_id,is_correct,has_image_alt,alternative,answer_image
0,1,"aumentar a concentração atmosférica de H2O, molécula capaz de absorver grande quantidade de calor.",1,0,0,a,
1,2,"remover moléculas orgânicas polares da atmosfera, diminuindo a capacidade delas de reter calor.",1,0,0,b,
2,3,reduzir o calor irradiado pela Terra mediante a substituição da produção primária pela industrialização refrigerada.,1,1,0,c,
3,4,"promover a queima da biomassa vegetal, responsável pelo aumento do efeito estufa devido à produção de CH4.",1,0,0,d,
4,5,"reduzir o desmatamento, mantendo-se, assim, o potencial da vegetação em absorver o CO2 da atmosfera.",1,0,0,e,
5,6,"pela promoção de um modo de vida saudável, que mostrava os jovens como exemplos a seguir.",2,1,0,a,
6,7,"pelo diálogo, ao organizar debates que opunham jovens idealistas e velhas lideranças conservadoras.",2,0,0,b,
7,8,pelos métodos políticos populistas e pela organização de comícios multitudinários.,2,0,0,c,
8,9,pelo sectarismo e pela forma violenta e radical com que enfrentavam os opositores ao regime.,2,0,0,d,
9,10,pelas propostas de conscientização da população acerca dos seus direitos como cidadãos.,2,0,0,e,
10,11,as áreas não-florestais ficam restritas a refúgios ecológicos devido à baixa adaptabilidade de espécies não-florestais a ambientes áridos.,3,0,0,a,
11,12,"grande parte da diversidade de espécies vegetais é reduzida, uma vez que necessitam de condições semelhantes a dos períodos interglaciais.",3,0,0,b,
12,13,"a vegetação comum ao cerrado deve ter se limitado a uma pequena região do centro do Brasil, da qual se expandiu até atingir a atual distribuição.",3,0,0,c,
13,14,"plantas com adaptações ao clima árido, como o desenvolvimento de estruturas que reduzem a perda de água, devem apresentar maior área de distribuição.",3,1,0,d,
14,15,"florestas tropicais como a amazônica apresentam distribuição geográfica mais ampla, uma vez que são densas e diminuem a ação da radiação solar sobre o solo e reduzem os efeitos da aridez.",3,0,0,e,
15,16,"a corrida armamentista, o terceiro-mundismo e o expansionismo soviético.",4,1,0,a,
16,17,"a Revolução Bolchevique, o imperialismo e a unificação da Alemanha.",4,0,0,b,
17,18,"a crise do colonialismo, a ascensão do nacionalismo e do totalitarismo.",4,0,0,c,
18,19,"o enfraquecimento do império britânico, a Grande Depressão e a corrida nuclear.",4,0,0,d,
19,20,"o declínio britânico, o fracasso da Liga das Nações e a Revolução Cubana.",4,0,0,e,
20,21,"significava a solução para os problemas econômicos, uma vez que os faraós sacrificavam aos deuses suas riquezas, construindo templos.",5,1,0,a,
21,22,"representava a possibilidade de o faraó ordenar a sociedade, obrigando os desocupados a trabalharem em obras públicas, que engrandeceram o próprio Egito.",5,0,0,b,
22,23,"significava um peso para a população egípcia, que condenava o luxo faraônico e a religião baseada em crenças e superstições.",5,0,0,c,
23,24,"significava, entre outros aspectos, o poder que os faraós tinham para escravizar grandes contingentes populacionais que trabalhavam nesses monumentos.",5,0,0,d,
24,25,representava para as populações do alto Egito a possibilidade de migrar para o sul e encontrar trabalho nos canteiros faraônicos.,5,0,0,e,
25,26,"impedir a abertura e a pavimentação de rodovias em áreas rurais e em regiões preservadas, pois a qualidade de vida e as tecnologias encontradas nos centros urbanos são prescindíveis às populações rurais.",6,0,0,a,
26,27,"impedir a abertura e a pavimentação de rodovias em áreas rurais e em regiões preservadas, promovendo a migração das populações rurais para os centros urbanos, onde a qualidade de vida é melhor.",6,0,0,b,
27,28,"permitir a abertura e a pavimentação de rodovias apenas em áreas rurais produtivas, haja vista que nas demais áreas o retorno financeiro necessário para produzir uma melhoria na qualidade de vida da região não é garantido.",6,0,0,c,
28,29,"permitir a abertura e a pavimentação de rodovias, desde que comprovada a sua real necessidade e após a realização de estudos que demonstrem ser possível contornar ou compensar seus impactos ambientais.",6,1,0,d,
29,30,"permitir a abertura e a pavimentação de rodovias, haja vista que os impactos ao meio ambiente são temporários e podem ser facilmente revertidos com as tecnologias existentes para recuperação de áreas degradadas.",6,0,0,e,
30,31,o consumo não renovável de toda água que passa pelas turbinas.,7,0,0,a,
31,32,"o aprofundamento no leito do rio, com a menor deposição de resíduos no trecho de rio anterior à represa.",7,1,0,b,
32,33,a poluição da água por metais da usina.,7,0,0,c,
33,34,a destruição do habitat de animais terrestres.,7,0,0,d,
34,35,o aumento expressivo na liberação de CO2 para a atmosfera.,7,0,0,e,
35,36,União Europeia.,8,1,0,a,
36,37,Convenção de Ramsar.,8,0,0,b,
37,38,Conferência de Estocolmo.,8,0,0,c,
38,39,Cortina de Ferro.,8,0,0,d,
39,40,Muro de Berlim.,8,0,0,e,
40,41,o palácio de Versalhes.,9,1,0,a,
41,42,o Museu Britânico.,9,0,0,b,
42,43,a catedral de Colônia.,9,0,0,c,
43,44,a Casa Branca.,9,0,0,d,
44,45,a pirâmide do faraó Quéops.,9,0,0,e,
45,46,"criar nas cidades, especialmente naquelas com mais de 100 mil habitantes, pontos estratégicos de coleta de baterias e pilhas, para posterior repasse a fabricantes e/ou importadores.",10,0,0,a,
46,47,"exigir que fabricantes invistam em pesquisa para a substituição desses metais tóxicos por substâncias menos nocivas ao homem e ao ambiente, e que não sejam bioacumulativas.",10,0,0,b,
47,48,deixar de consumir aparelhos elétricos que utilizem pilha ou bateria como fonte de energia.,10,0,0,c,
48,49,"usar apenas pilhas ou baterias recarregáveis e de vida útil longa e evitar ingerir alimentos contaminados, especialmente peixes.",10,0,0,d,
49,50,"devolver pilhas e baterias, após o esgotamento da energia armazenada, à rede de assistência técnica especializada para repasse a fabricantes e/ou importadores.",10,1,0,e,
50,51,"resultaram no fortalecimento do conservadorismo político, social e religioso que prevaleceu nos países ocidentais durante as décadas de 70 e 80.",11,0,0,a,
51,52,"tiveram baixa repercussão no plano político, apesar de seus fortes desdobramentos nos planos social e cultural, expressos na mudança de costumes e na contracultura.",11,0,0,b,
52,53,"inspiraram futuras mobilizações, como o pacifismo, o ambientalismo, a promoção da equidade de gêneros e a defesa dos direitos das minorias.",11,0,0,c,
53,54,"foram manifestações desprovidas de conotação política, que tinham o objetivo de questionar a rigidez dos padrões de comportamento social fundados em valores tradicionais da moral religiosa.",11,0,0,d,
54,55,"restringiram-se às sociedades de países desenvolvidos, onde a industrialização avançada, a penetração dos meios de comunicação de massa e a alienação cultural que deles resultava eram mais evidentes.",11,1,0,e,
55,56,a floresta não possui organismos decompositores.,12,0,0,a,
56,57,o potencial econômico da floresta deve ser explorado.,12,0,0,b,
57,58,o homem branco convive harmonicamente com urihi.,12,0,0,c,
58,59,as folhas e a água são menos importantes para a floresta que seu sopro vital.,12,0,0,d,
59,60,Wixia é a capacidade que tem a floresta de se sustentar por meio de processos vitais.,12,1,0,e,
60,61,"a umidade relativa do ar indica, em termos absolutos, a quantidade de vapor de água existente na atmosfera.",13,1,0,a,
61,62,"a variação da umidade do ar se verifica no verão, e não no inverno, quando as temperaturas permanecem baixas.",13,0,0,b,
62,63,a insolação é um fator que provoca variação da umidade relativa do ar.,13,0,0,c,
63,64,o ar vai adquirindo maior quantidade de vapor de água à medida que se aquece.,13,0,0,d,
64,65,a presença de umidade relativa do ar é diretamente proporcional à temperatura do ar.,13,0,0,e,
65,66,a luta dos negros sul-africanos contra o apartheid inspirada por valores dos primeiros cristãos.,14,1,0,a,
66,67,"o fortalecimento político de Napoleão Bonaparte, que se justificava na amplitude de poderes que tivera Carlos Magno.",14,0,0,b,
67,68,"a tradição heroica da cavalaria medieval, que foi afetada negativamente pelas produções cinematográficas de Hollywood.",14,0,0,c,
68,69,a associação que Hitler estabeleceu entre o III Reich e o Sacro Império Romano Germânico.,14,0,0,d,
69,70,"o retorno dos valores cristãos medievais, presentes nos documentos do Concílio Vaticano II.",14,0,0,e,
70,71,"buscavam o êxito, descurando as virtudes cívicas.",15,0,0,a,
71,72,tinham na vida moral uma garantia de enriquecimento rápido.,15,0,0,b,
72,73,valorizavam um conceito de honra dissociado do comportamento ético.,15,0,0,c,
73,74,relacionavam a conduta moral dos indivíduos com o progresso econômico.,15,1,0,d,
74,75,acreditavam que o comportamento casto perturbava a harmonia doméstica.,15,0,0,e,
75,76,"tinha profundas conexões com a justiça, razão pela qual o tempo livre dos cidadãos deveria ser dedicado às atividades vinculadas aos tribunais.",16,0,0,a,
76,77,"vivida pelos atenienses era, de fato, restrita àqueles que se dedicavam à política e que tinham tempo para resolver os problemas da cidade.",16,1,0,b,
77,78,"possui uma dimensão histórica que deve ser criticada, pois é condenável que os políticos de qualquer época fiquem entregues à ociosidade, enquanto o resto dos cidadãos tem de trabalhar.",16,0,0,c,
78,79,"era entendida como uma dignidade própria dos grupos sociais superiores, fruto de uma concepção política profundamente hierarquizada da sociedade.",16,0,0,d,
79,80,"estava vinculada, na Grécia Antiga, a uma percepção política democrática, que levava todos os habitantes da pólis a participarem da vida cívica.",16,0,0,e,
80,81,"Brasil, glória no passado, grandeza no presente.",17,0,0,a,
81,82,"Brasil, terra bela, pátria grande.",17,1,0,b,
82,83,"Brasil, gigante pela própria natureza.",17,0,0,c,
83,84,"Brasil, um país que vai pra frente.",17,0,0,d,
84,85,"Brasil, a eterna esperança.",17,0,0,e,
85,86,a Constituição de 1934 avançou ao reduzir a idade mínima para votar.,18,0,0,a,
86,87,"a Constituição de 1891, ao se referir a cidadãos, referia-se também às mulheres.",18,0,0,b,
87,88,os textos de ambas as Cartas permitiam que qualquer cidadão fosse eleitor.,18,0,0,c,
88,89,o texto da carta de 1891 já permitia o voto feminino.,18,0,0,d,
89,90,a Constituição de 1891 considerava eleitores apenas indivíduos do sexo masculino.,18,1,0,e,
90,91,consolidar a imagem de Vargas como um governante protetor das massas.,19,0,0,a,
91,92,"aumentar os grupos de discussão política dos trabalhadores, estimulados pelas palavras do ministro.",19,0,0,b,
92,93,"conscientizar os trabalhadores de que os direitos sociais foram conquistados por seu esforço, após anos de lutas sindicais.",19,0,0,c,
93,94,"promover a autonomia dos grupos sociais, por meio de uma linguagem simples e de fácil entendimento.",19,1,0,d,
94,95,"estimular os movimentos grevistas, que reivindicavam um aprofundamento dos direitos trabalhistas.",19,0,0,e,
95,96,estimular a formação de propriedades comunais.,20,0,0,a,
96,97,vincular democracia e possibilidades econômicas individuais.,20,0,0,b,
97,98,defender a obrigação de que todos os indivíduos tenham propriedades.,20,0,0,c,
98,99,submeter o indivíduo à proteção do governo.,20,1,0,d,
99,100,hierarquizar os indivíduos segundo suas posses.,20,0,0,e,
100,101,"Devido à falta de recursos naturais a serem explorados no Brasil, conflitos étnicos e culturais como os ocorridos na África estiveram ausentes no período da independência e formação do Estado brasileiro.",21,0,0,a,
101,102,"A maior distinção entre os processos histórico formativos dos continentes citados é a que se estabelece entre colonizador e colonizado, ou seja, entre a Europa e os demais.",21,1,0,b,
102,103,"À época das conquistas, a América Latina, a África e a Ásia tinham sistemas políticos e administrativos muito mais sofisticados que aqueles que lhes foram impostos pelo colonizador.",21,0,0,c,
103,104,"Comparadas ao México e ao Peru, as instituições brasileiras, por terem sido eliminadas à época da conquista, sofreram mais influência dos modelos institucionais europeus.",21,0,0,d,
104,105,"O modelo histórico da formação do Estado asiático equipara-se ao brasileiro, pois em ambos se manteve o espírito das formas de organização anteriores à conquista.",21,0,0,e,
105,106,a Constituição de 1937 seria a preparação para uma futura democracia liberal.,22,0,0,a,
106,107,Vargas seria o homem capaz de exercer o poder de modo inteligente e correto.,22,0,0,b,
107,108,"os eleitores, políticos e juízes seriam mal-intencionados.",22,0,0,c,
108,109,"o governo Vargas seria um mal necessário, mas transitório.",22,0,0,d,
109,110,Vargas seria o homem adequado para implantar a democracia de partidos.,22,1,0,e,
110,111,os ingredientes em decomposição das poções mágicas eram condenados porque afetavam a saúde da população.,23,0,0,a,
111,112,"as feiticeiras representavam séria ameaça à sociedade, pois eram perceptíveis suas tendências feministas.",23,0,0,b,
112,113,os cristãos deviam preservar a instituição do casamento recorrendo exclusivamente aos ensinamentos da Igreja.,23,0,0,c,
113,114,"o problema dos métodos citados no trecho residia na dissimulação, que acabava por enganar o enfeitiçado.",23,0,0,d,
114,115,o diabo era um concorrente poderoso da autoridade da Igreja e somente a justiça do fogo poderia eliminá-lo.,23,1,0,e,
115,116,"o Brasil é um país periférico na ordem mundial, devido às diferentes conjunturas de inserção internacional.",24,0,0,a,
116,117,"as possibilidades de fazer prevalecer ideias e conceitos próprios, no que tange aos temas do comércio internacional e dos países em desenvolvimento, são mínimas.",24,0,0,b,
117,118,as brechas do sistema internacional não foram bem aproveitadas para avançar posições voltadas para a criação de uma área de cooperação e associação integrada a seu entorno geográfico.,24,0,0,c,
118,119,os grandes debates nacionais acerca da inserção internacional do Brasil foram embasados pelas elites do Império e da República por meio de consultas aos diversos setores da população.,24,0,0,d,
119,120,"a atuação do Brasil em termos de política externa evidencia que o país tem capacidade decisória própria, mesmo diante dos constrangimentos internacionais.",24,1,0,e,
120,121,"do repúdio que os escravos trabalhadores dos portos demonstravam contra os marinheiros, porque estes representavam a elite branca opressora.",25,1,0,a,
121,122,"da expulsão de vários líderes negros independentistas, que defendiam a implantação de uma república negra, a exemplo do Haiti.",25,0,0,b,
122,123,"dos rumores acerca da revolta escrava do Haiti, que circulavam entre a população escrava e entre os mestiços pobres, alimentando seu desejo por mudanças.",25,0,0,c,
123,124,"da rejeição aos portugueses, brancos, que significava a rejeição à opressão da Metrópole, como ocorreu na Noite das Garrafadas.",25,0,0,d,
124,125,"do apoio que escravos e negros forros deram à monarquia, com a perspectiva de receber sua proteção contra as injustiças do sistema escravista.",25,0,0,e,
125,126,os novos teares exigiam treinamento especializado para serem operados.,26,0,0,a,
126,127,"os artesãos, no período anterior, combinavam a tecelagem com o cultivo de subsistência.",26,0,0,b,
127,128,os trabalhadores não especializados se apropriaram dos lugares dos antigos artesãos nas fábricas.,26,0,0,c,
128,129,a invenção do tear propiciou o surgimento de novas relações sociais.,26,1,0,d,
129,130,os tecelões mais hábeis prevaleceram sobre os inexperientes.,26,0,0,e,
130,131,a erradicação da fome no mundo.,27,0,0,a,
131,132,o aumento das áreas rurais e a diminuição das áreas urbanas.,27,0,0,b,
132,133,"a maior demanda por recursos naturais, entre os quais os recursos energéticos.",27,1,0,c,
133,134,a menor necessidade de utilização de adubos e corretivos na agricultura.,27,0,0,d,
134,135,"o contínuo aumento da oferta de emprego no setor primário da economia, em face da mecanização.",27,0,0,e,
135,136,"as populações nos grandes centros urbanos e no meio rural recorrem aos instrumentos e tecnologias de informação basicamente como meio de comunicação mútua, e não os veem como fontes de educação e cultura.",28,1,0,a,
136,137,"a intensificação do fluxo de comunicação por meios eletrônicos, característica do processo de globalização, está dissociada do desenvolvimento social e cultural que ocorre no meio rural.",28,0,0,b,
137,138,"a ampla difusão das tecnologias de informação nos centros urbanos e no meio rural suscita o contato entre diferentes culturas e, ao mesmo tempo, traz a necessidade de reformular as concepções tradicionais de educação.",28,0,0,c,
138,139,"a apropriação, por parte de um grupo social, de valores e ideias de outras culturas para benefício próprio é fonte de conflitos e ressentimentos.",28,0,0,d,
139,140,"as mudanças sociais e culturais que acompanham o processo de globalização, ao mesmo tempo em que refletem a preponderância da cultura urbana, tornam obsoletas as formas de educação tradicionais próprias do meio rural.",28,0,0,e,
140,141,o processo de migração para o Sudeste contribui para o fenômeno conhecido como inchaço urbano.,29,0,0,a,
141,142,"as migrações para o sudeste desencadearam a valorização do trabalho manual, sobretudo na década de 80.",29,0,0,b,
142,143,"a falta de especialização dos migrantes é positiva para os empregadores, pois significa maior versatilidade profissional.",29,1,0,c,
143,144,o processo migratório foi desencadeado por ações de governo para viabilizar a produção industrial no Sudeste.,29,0,0,d,
144,145,os governos estaduais do Sudeste priorizaram a qualificação da mão-de-obra migrante.,29,0,0,e,
145,146,"ambiente de pobreza e privação, que carece de conforto mínimo para a sobrevivência da família.",30,0,0,a,
146,147,"mundo mágico, capaz de recuperar o encantamento perdido durante o período de decadência da aristocracia rural mineira.",30,0,0,b,
147,148,"cena familiar, na qual o calor humano dos habitantes da casa ocupa o primeiro plano, compensando a frieza e austeridade dos objetos antigos.",30,0,0,c,
148,149,"símbolo de um passado ilustre que, apesar de superado, ainda resiste à sua total dissolução graças ao cuidado e asseio que a família dispensa à conservação da casa.",30,0,0,d,
149,150,"espaço arruinado, onde os objetos perderam seu esplendor e sobre os quais a vida repousa como lembrança de um passado que está em vias de desaparecer completamente.",30,1,0,e,
150,151,os fazendeiros puderam prescindir da mão-de-obra europeia e contrataram trabalhadores brasileiros provenientes de outras regiões para trabalhar em suas plantações.,31,0,0,a,
151,152,"as notícias de terras acessíveis atraíram para São Paulo grande quantidade de imigrantes, que adquiriram vastas propriedades produtivas.",31,1,0,b,
152,153,"o percurso dos imigrantes até o interior, antes das ferrovias, era feito a pé ou em muares; no entanto, o tempo de viagem era aceitável, uma vez que o café era plantado nas proximidades da capital, São Paulo.",31,0,0,c,
153,154,a expansão da malha ferroviária pelo interior de São Paulo permitiu que mão-de-obra estrangeira fosse contratada para trabalhar em cafezais de regiões cada vez mais distantes do porto de Santos.,31,0,0,d,
154,155,"o escoamento da produção de café se viu beneficiado pelos aportes de capital, principalmente de colonos italianos, que desejavam melhorar sua situação econômica.",31,0,0,e,
155,156,constituírem um passo importante para a diminuição das desigualdades sociais causadas pela polarização social e pela segregação urbana.,32,0,0,a,
156,157,"terem sido diretamente impactadas pelo processo de internacionalização da economia, desencadeado a partir do final dos anos 1970.",32,0,0,b,
157,158,terem sua origem diretamente relacionadas ao processo de colonização ocidental do século XIX.,32,0,0,c,
158,159,possuírem o mesmo nível de influência no cenário mundial.,32,1,0,d,
159,160,fortalecerem os laços de cidadania e solidariedade entre os membros das diversas comunidades.,32,0,0,e,
160,161,negociam com os fazendeiros o reajuste dos honorários e a redução da carga horária de trabalho.,33,0,0,a,
161,162,defendem os direitos dos consumidores junto aos armazéns e mercados das fazendas e carvoarias.,33,0,0,b,
162,163,substituem as autoridades policiais e jurídicas na resolução dos conflitos entre patrões e empregados.,33,0,0,c,
163,164,encaminham denúncias ao Ministério Público e promovem ações de conscientização dos trabalhadores.,33,1,0,d,
164,165,fortalecem a administração pública ao ministrarem aulas aos seus servidores.,33,0,0,e,
165,166,"a situação conflituosa vivida no campo, que impede o crescimento da produção agrícola.",34,0,0,a,
166,167,os sistemas de cultivo mecanizado voltados para o abastecimento do mercado interno.,34,0,0,b,
167,168,a baixa inserção de sua agricultura no comércio mundial.,34,1,0,c,
168,169,a quantidade insuficiente de mão-de-obra para o trabalho agrícola.,34,0,0,d,
169,170,a presença de estruturas agrárias arcaicas formadas por latifúndios improdutivos.,34,0,0,e,
170,171,as duas civilizações tinham cidades autônomas e independentes entre si.,35,0,0,a,
171,172,"os povos do Xingu falavam uma mesma língua, tal como nas cidades-Estado da Grécia.",35,0,0,b,
172,173,as cidades do Xingu dedicavam-se à arte e à filosofia tal como na Grécia.,35,1,0,c,
173,174,as ruínas das cidades mencionadas atestam que grandes epidemias dizimaram suas populações.,35,0,0,d,
174,175,"as cidades do Xingu desenvolveram a democracia, tal como foi concebida em Tebas.",35,0,0,e,
175,176,"a diminuição do comércio entre países e regiões, que se tornaram autossuficientes na produção de bens e serviços.",36,0,0,a,
176,177,"a ocorrência de desastres ambientais de grandes proporções, como no caso de derramamento de óleo por navios petroleiros.",36,1,0,b,
177,178,"a melhora generalizada das condições de vida da população mundial, a partir da eliminação das desigualdades econômicas na atualidade.",36,0,0,c,
178,179,"o desmatamento, que eliminou grandes extensões de diversos biomas improdutivos, cujas áreas passaram a ser ocupadas por centros industriais modernos.",36,0,0,d,
179,180,"o aumento demográfico mundial, sobretudo nos países mais desenvolvidos, que apresentam altas taxas de crescimento vegetativo.",36,0,0,e,
180,181,"do norte do Mato Grosso, área de expansão da agricultura mecanizada, é a mais violenta do país.",37,0,0,a,
181,182,da Zona da Mata mineira teve o maior registro de mortes.,37,1,0,b,
182,183,conhecida historicamente como das Missões Jesuíticas é a de maior violência.,37,0,0,c,
183,184,do Bico do Papagaio apresenta os números mais expressivos.,37,0,0,d,
184,185,conhecida como oeste baiano tem o maior número de mortes.,37,0,0,e,
185,186,"garantir, aos países em desenvolvimento, acesso a matérias-primas e energia, necessárias ao crescimento econômico.",38,1,0,a,
186,187,"contribuir para a redução da poluição em áreas ambientalmente já degradadas devido ao grande volume da produção industrial, como ocorreu na Europa.",38,0,0,b,
187,188,"promover a participação dos combustíveis fósseis na matriz energética mundial, dominada, majoritariamente, pelas fontes renováveis, de maior custo.",38,0,0,c,
188,189,situar-se em uma zona geopolítica mais estável que o Oriente Médio.,38,0,0,d,
189,190,"possibilitar o povoamento de uma região pouco habitada, além de promover seu desenvolvimento econômico.",38,0,0,e,
190,191,a cultura dos povos é reduzida a exemplos esquemáticos que não encontram respaldo na história do Brasil ou da América.,39,0,0,a,
191,192,"as cidades, na primeira afirmação, têm um papel mais fraco na vida social, enquanto a América é mostrada como um exemplo a ser evitado.",39,0,0,b,
192,193,"a objeção inicial, de que as cidades não podem ser inventadas, é negada logo em seguida pelo exemplo utópico da colonização da América.",39,0,0,c,
193,194,"a concepção fundamental da primeira afirmação defende a construção de cidades e a segunda mostra, historicamente, que essa estratégia acarretou sérios problemas.",39,0,0,d,
194,195,"a primeira entende que as cidades devem ser organismos vivos, que nascem de forma espontânea, e a segunda mostra que há exemplos históricos que demonstram o contrário.",39,1,0,e,
195,196,"a região Norte apresenta o segundo menor percentual de imóveis produtivos, possivelmente em razão da presença de densa cobertura florestal, protegida por legislação ambiental.",40,1,0,a,
196,197,"a região Centro-Oeste apresenta o menor percentual de área ocupada por minifúndios, o que inviabiliza políticas de reforma agrária nesta região.",40,0,0,b,
197,198,imóveis improdutivos são predominantes em relação às demais formas de ocupação da terra no âmbito nacional e na maioria das regiões.,40,0,0,c,
198,199,"o índice de 63,8% de imóveis improdutivos demonstra que grande parte do solo brasileiro é de baixa fertilidade, impróprio para a atividade agrícola.",40,0,0,d,
199,200,"o percentual de imóveis improdutivos iguala-se ao de imóveis produtivos somados aos minifúndios, o que justifica a existência de conflitos por terra.",40,0,0,e,
